{"schema":"harness.policy-bundle.v1","bundle_id":"bundle-1","repository_id":"repo","task_family":"context","components":[{"dimension":"token_budget","manifest_digest":"aaaaaaaaaaaaaaaaaaaaaaaaaaaaaaaaaaaaaaaaaaaaaaaaaaaaaaaaaaaaaaaa","risk_class":"green"}],"parent_bundle_id":null,"safety_anchor_digest":"aaaaaaaaaaaaaaaaaaaaaaaaaaaaaaaaaaaaaaaaaaaaaaaaaaaaaaaaaaaaaaaa","sha256":"5b2b676d10fb1c9d8b3c08e6854291d562add3642d646e185fe3ff807ed9df44"}
